Song,URL
Frontin' (feat. Jay-Z) - Club Mix Pharrell Williams,https://www.youtube.com/watch?v=LOtkH5amC7s
The Godfather Spoonie Gee,https://www.youtube.com/watch?v=dn5U7FtyN1A
For The Night (feat. Lil Baby & DaBaby) Pop Smoke,https://www.youtube.com/watch?v=Q9pjm4cNsfc
Something He Can Feel Aretha Franklin,https://www.youtube.com/watch?v=YhuEY79gMzg
Let's Ride Q-Tip,https://www.youtube.com/watch?v=QVB5Q_bNcCY
Controlla Westy,https://www.youtube.com/watch?v=Y2VEkxK7l1w
Straight Outta Compton N.W.A.,https://www.youtube.com/watch?v=TMZi25Pq3T8
Yeah Kool (feat. Lil Uzi Vert) FXXXXY,https://www.youtube.com/watch?v=Z1FvNXFgHNQ
Territorial YoungBoy Never Broke Again,https://www.youtube.com/watch?v=Qk4cZvyGux4
Stalli (Freestyle) Megan Thee Stallion,https://www.youtube.com/watch?v=gvSD05Yu7Ig
"Get Up, Stand Up Bob Marley & The Wailers",https://www.youtube.com/watch?v=UubfH-1S43k
Obito Offica,https://www.youtube.com/watch?v=37cR3hBAcUE
Variation Big Zuu,https://www.youtube.com/watch?v=NyYjuE-nKY0
Circles Megan Thee Stallion,https://www.youtube.com/watch?v=hfRWBM90OA4
שיר נחמה Hadag Nahash,https://www.youtube.com/watch?v=d1uvv83Z_FY
3:15 (Breathe) Russ,https://www.youtube.com/watch?v=Y6-n3JRwmsE
Strange Stains Kendre Streeter,https://www.youtube.com/watch?v=lu-8n9NWRXw
אני מאמין Hadag Nahash,https://www.youtube.com/watch?v=HTkmOPkuIpo
Poor Georgie MC Lyte,https://www.youtube.com/watch?v=hSTzr2V4KMw
Jus' a Rascal Dizzee Rascal,https://www.youtube.com/watch?v=0pnJPX60vXA
Otherside Of America Meek Mill,https://www.youtube.com/watch?v=JUnc3kl0DcA
Never Left Lil Tecca,https://www.youtube.com/watch?v=0ofKT9TGMPs
Oil Gang Dullah Beatz,https://www.youtube.com/watch?v=VcJOCQ3e3yk
Laid Back Koralle,https://www.youtube.com/watch?v=XqOhfoExCf0
יום קיץ Tuna,https://www.youtube.com/watch?v=jq7S8UJAV98
Made It (Can't Stay) Eli Sostre,https://www.youtube.com/watch?v=KICqpXMcNA8
Just a Friend Biz Markie,https://www.youtube.com/watch?v=9aofoBrFNdg
אני רוצה לזוז Tomer Yosef,https://www.youtube.com/watch?v=TTnfsU1-PNg
no sense Baby Keem,https://www.youtube.com/watch?v=5lrMlex9_nk
Let's Go (feat. Big D & Twista) Trick Daddy,https://www.youtube.com/watch?v=D0sjCgS7vi8
אמונה עיוורת Ravid Plotnik,https://www.youtube.com/watch?v=z3Cg0rxhuaA
Slang Like This - Instrumental True Tiger,https://www.youtube.com/watch?v=4cQ87B6-iIo
Strikers namesbliss,https://www.youtube.com/watch?v=5djF9B07yoY
Why You Wanna T.I.,https://www.youtube.com/watch?v=U6z_cilnJzg
Sittin' Sidewayz (feat. Big Pokey) Paul Wall,https://www.youtube.com/watch?v=wJoU6Vbf-_o
Herringbone Topaz Jones,https://www.youtube.com/watch?v=rxPFrmh0INo
Move (feat. Saweetie) Lil Tjay,https://www.youtube.com/watch?v=JIyYgA5nYKg
What Love (feat. Calboy) Laney Keyz,https://www.youtube.com/watch?v=GTaA_U1vUQg
SOMEBODY (feat. Vory) - from the Crimson Soundtrack BEAM,https://www.youtube.com/watch?v=8ywpXOW2v60
Try Me Lil Mosey,https://www.youtube.com/watch?v=XkUciRZCNng
Know The Ledge Eric B. & Rakim,https://www.youtube.com/watch?v=OPkWYTUiPTo
Bionic Muscle Truffel the Phunky Phaqir,https://www.youtube.com/watch?v=PJvL4gkXfk8
Taking Over Tom The Mail Man,https://www.youtube.com/watch?v=I9ciui5O96c
Medicine CJ Fly,https://www.youtube.com/watch?v=90_gJbV_ZtY
Same Bros SD Muni,https://www.youtube.com/watch?v=ifgfaAifNTU
Is Someone There? P Money,https://www.youtube.com/watch?v=O-Aq9FR4s0U
Put in Work BlabberMouf,https://www.youtube.com/watch?v=uOXw3z3h52I
"Beverly Hills, Chicago Gwendolyn Brooks",https://www.youtube.com/watch?v=uuK6gfOxhgQ
Revenge XXXTENTACION,https://www.youtube.com/watch?v=CD_tD26E7k0
Dumping Again Manga Saint Hilare,https://www.youtube.com/watch?v=G5YTzQ4gjAE
"After The Storm (feat. Tyler, The Creator & Bootsy Collins) - Pete Rock Remix Kali Uchis",https://www.youtube.com/watch?v=UVSnYb5Afgw
That's the Joint Funky 4 + 1,https://www.youtube.com/watch?v=SVxk9PW62Vk
Ugly (feat. Gucci Mane) Pooh Shiesty,https://www.youtube.com/watch?v=JdQmPVd1KuY
Bussdown (feat. Shaybo) Jorja Smith,https://www.youtube.com/watch?v=1XjOSNdalsc
Good Days SZA,https://www.youtube.com/watch?v=2p3zZoraK9g
Need It Migos,https://www.youtube.com/watch?v=u0LaoQks5mY
Rey Mysterio Anoyd,https://www.youtube.com/watch?v=XdtgvB1o1Sg
On God Latto,https://www.youtube.com/watch?v=ND6c5j2kypQ
Dark Skinned RAY BLK,https://www.youtube.com/watch?v=kFms1Cs0DgU
Bundles (feat. Taylor Girlz) Kayla Nicole,https://www.youtube.com/watch?v=Rt36nK2AN9g
Black Is Beautiful Chronixx,https://www.youtube.com/watch?v=jGLuJ64Qft4
Vibe With You (feat. Ty Dolla $ign) YG,https://www.youtube.com/watch?v=QiQu5errB_A
UMI Says Mos Def,https://www.youtube.com/watch?v=vntLKOd9saI
לא הכל מן אללה E-Z,https://www.youtube.com/watch?v=Z_E-2XhANVU
Lil Story (feat. ScHoolboy Q) Gucci Mane,https://www.youtube.com/watch?v=KVu9dy1LYPM
Déjà vu D Power Diesle,https://www.youtube.com/watch?v=mxns8fcCtz0
Many Men (Curtis) Katori Walker,https://www.youtube.com/watch?v=eKaZladKJpo
Pump Me Up Trouble Funk,https://www.youtube.com/watch?v=xg5IRsPs5E8
Gone Mad Blay Vision,https://www.youtube.com/watch?v=cEH2SPLrbb4
That's Not Gangsta Sincere,https://www.youtube.com/watch?v=60M6oKdSHTA
Ballin' (with Roddy Ricch) Mustard,https://www.youtube.com/watch?v=YS0h2-hy9rw
Melanin In The Hamptons Dandila,https://www.youtube.com/watch?v=J69bP8Tf7ZE
Freaks Come Out at Night Whodini,https://www.youtube.com/watch?v=FxwrLLlQwBw
Tom Cruise Abhi The Nomad,https://www.youtube.com/watch?v=f1Qm1N9maxw
DOOM Cap Kendricks,https://www.youtube.com/watch?v=Ole-50G0jtU
Walk Down (feat. Pooh Shiesty) BigKayBeezy,https://www.youtube.com/watch?v=eOq_jGyYib0
Perfect Timing YG,https://www.youtube.com/watch?v=j0H6JrByUbM
Hood Dreams LBS Kee'vin,https://www.youtube.com/watch?v=QLDXkalNbSk
Rose Gold (feat. King Von) PnB Rock,https://www.youtube.com/watch?v=X1qm6hhMe78
Somethings Happening The Starting 5ive,https://www.youtube.com/watch?v=jeuycCuaGcI
Chopstix Taleban Dooda,https://www.youtube.com/watch?v=2DJl0dnUfR0
High Right Now M24,https://www.youtube.com/watch?v=erTlh83J-H0
HEAVY Ivy Sole,https://www.youtube.com/watch?v=bElD9ZNoVTE
Kitchenette Gwendolyn Brooks,https://www.youtube.com/watch?v=7yQ7hOjX9v0
Safe N Sound Kamakaze,https://www.youtube.com/watch?v=Dx6Wnbw9wlo
Another Day Demrick,https://www.youtube.com/watch?v=K_liQexGFHI
Ahla Combina Axum,https://www.youtube.com/watch?v=JlYCzv03K8s
Superstar Dro Kenji,https://www.youtube.com/watch?v=_iFsovnAUAQ
Focused Yung Baby Tate,https://www.youtube.com/watch?v=V8ZbrZu9iDY
The Hurt Business (feat. M V P) - Remix Westside Gunn,https://www.youtube.com/watch?v=NaWBPNXD3Gg
Slippin' Into Darkness War,https://www.youtube.com/watch?v=RFSWW4O6QNM
Charmaine Plan B,https://www.youtube.com/watch?v=fCR8ttUTGPA
Quest For Coin II Ezra Collective,https://www.youtube.com/watch?v=lcE7fp2nK-c
סחימת Peled,https://www.youtube.com/watch?v=TbfFsFQJXNs
Just Like Martin IDK,https://www.youtube.com/watch?v=CIOpi5cuyzs
My Part of Town Tuff Crew,https://www.youtube.com/watch?v=EUiKSkCyRIs
Damn It Feels Good to Be a Gangsta Geto Boys,https://www.youtube.com/watch?v=6IJCFc_qkHw
Star Shopping Lil Peep,https://www.youtube.com/watch?v=qwzQPh7dW_4
Full Throttle Ard Adz,https://www.youtube.com/watch?v=tkxOtataz7M
Hip Hop Be Bop (Original Version) Man Parrish,https://www.youtube.com/watch?v=7tsfJn8YdwQ
Funkdafied Da Brat,https://www.youtube.com/watch?v=zfpR9jKy0IQ
Call Me Aretha Franklin,https://www.youtube.com/watch?v=-GQSLe4OmIY
Daydreamin' (feat. Jill Scott) Lupe Fiasco,https://www.youtube.com/watch?v=7XOAStfv-v0
Hood Story (feat. NoCap) FCG Heem,https://www.youtube.com/watch?v=JqeanhadKAc
No Love ft. Mozzy & Cypress Moreno Kalan.FrFr,https://www.youtube.com/watch?v=jYJkg50cylM
Work The Angles Dilated Peoples,https://www.youtube.com/watch?v=Wo9SbgAtbac
Nice To Meet Ya (feat. Yxng Bane) Wes Nelson,https://www.youtube.com/watch?v=EpXzUMPfk7s
Alone (feat. Lil Durk) 42 Dugg,https://www.youtube.com/watch?v=4KqGugmymTU
Sock It 2 Me (feat. Da Brat) Missy Elliott,https://www.youtube.com/watch?v=9UvBX3REqSY
Talk to Me Lxst,https://www.youtube.com/watch?v=KtkNApTFr5k
Wit Dat TheHxliday,https://www.youtube.com/watch?v=3hj1ggWce-A
Everybody's Somebody Awon,https://www.youtube.com/watch?v=LHCENoyQIJs
Streets Doja Cat,https://www.youtube.com/watch?v=jJdlgKzVsnI
GLIMPSE JAHMED,https://www.youtube.com/watch?v=9QmRIP4ippE
O-o-h Child The Five Stairsteps,https://www.youtube.com/watch?v=dguz0IsCuKU
Hummer Butch Dawson,https://www.youtube.com/watch?v=Tq-GhlwyyeE
Go So Far Busty and the Bass,https://www.youtube.com/watch?v=pBxbJjjajNw
You Don't Know Loyle Carner,https://www.youtube.com/watch?v=kicO1xHwKzo
Droppin' Leikeli47,https://www.youtube.com/watch?v=8p6CD-MUflc
BUZZCUT (feat. Danny Brown) BROCKHAMPTON,https://www.youtube.com/watch?v=fsQhOCkczHQ
Express Yourself - Remix N.W.A.,https://www.youtube.com/watch?v=eJQG-b9redM
Rapper's Delight The Sugarhill Gang,https://www.youtube.com/watch?v=rKTUAESacQM
Child's Play (feat. 21 Savage) Young Nudy,https://www.youtube.com/watch?v=dehBp8UXaPo
Medicine (feat. Unknown T) Deno,https://www.youtube.com/watch?v=by5YKDstazY
Hard in Da Paint Waka Flocka Flame,https://www.youtube.com/watch?v=Ij4I67FHMhM
Enough is Enough (feat. Lethal Bizzle & Jme) BackRoad Gee,https://www.youtube.com/watch?v=it0TOvEreJ8
Levels namesbliss,https://www.youtube.com/watch?v=oXHMl4F2Cxw
They Reminisce Over You (T.R.O.Y.) Pete Rock & C.L. Smooth,https://www.youtube.com/watch?v=k6mdRv0ZdR8
LITW Afrikan Boy,https://www.youtube.com/watch?v=OKED2PyOfL0
03 Flow Wallie the Sensei,https://www.youtube.com/watch?v=z47rs-zmsFA
Boy Please AFN Peso,https://www.youtube.com/watch?v=4InrHlunxG0
Stereotypes Black Violin,https://www.youtube.com/watch?v=WYerKidQGcc
נרקומן NOROZ,https://www.youtube.com/watch?v=nLxbRtfNMNI
"fuego (feat. Tyler, The Creator) Channel Tres",https://www.youtube.com/watch?v=ERA08cM3cQs
gone girl iann dior,https://www.youtube.com/watch?v=q5wiUL9xdZQ
Shift Filthy Gears,https://www.youtube.com/watch?v=ly6qgCwU2vg
Gettin' Some Shawnna,https://www.youtube.com/watch?v=F1pwGVfV8S4
I Want It All (feat. Mack 10) Warren G,https://www.youtube.com/watch?v=4DB6HNvdxDw
Too Many Man Skepta,https://www.youtube.com/watch?v=8ujZYAtB0po
Blinded by the Lights The Streets,https://www.youtube.com/watch?v=QJD8mpcGykE
He Got Game Public Enemy,https://www.youtube.com/watch?v=F5d5omWxFJk
אנרגיה Tuna,https://www.youtube.com/watch?v=bMAH5-RPMMQ
Confused (feat. Future) Gucci Mane,https://www.youtube.com/watch?v=ZlzGwWfibEk
Luchini AKA This Is It Camp Lo,https://www.youtube.com/watch?v=WvAqy1i2hEA
Paper Planes Ghostface600,https://www.youtube.com/watch?v=92Tc9kfa8as
Bickenhead Cardi B,https://www.youtube.com/watch?v=ZTPhNIKeKgw
תופעות לוואי Aya Korem,https://www.youtube.com/watch?v=MLJxa7zw-z8
Cashew JD Cliffe,https://www.youtube.com/watch?v=pi7pW--hSJg
Baby Choppa Rot Ken,https://www.youtube.com/watch?v=mrkM5B2M8pY
לייגל אייז Hadag Nahash,https://www.youtube.com/watch?v=GqXojPeWReU
Rebel Without A Pause Public Enemy,https://www.youtube.com/watch?v=-fN5RX15Zhw
מילה Peled,https://www.youtube.com/watch?v=ZbYQfWg0uHQ
GNF (OKOKOK) Polo G,https://www.youtube.com/watch?v=gxykC33lTiQ
Late Night Calls Tee Grizzley,https://www.youtube.com/watch?v=roOw4ZNaVJ4
בולבול ממוצע Lukach,https://www.youtube.com/watch?v=OR0LIUJBu-g
Cookie Chips Rejjie Snow,https://www.youtube.com/watch?v=Dw3VcX0V7vM
Slam Onyx,https://www.youtube.com/watch?v=7ADgCeYJMN4
Top Boy Spitter (Never Been) Manga Saint Hilare,https://www.youtube.com/watch?v=TEjyIZ7eGHc
הכל זה בצוות Tuna,https://www.youtube.com/watch?v=UvWXabH7Npo
Born 2 Be Great Lil Tjay,https://www.youtube.com/watch?v=adLajTjaV9Q
Departure Prince Party,https://www.youtube.com/watch?v=XABFHBMx6uI
Trenches Morray,https://www.youtube.com/watch?v=yF5u8LOLJ9M
Hang on in There John Legend,https://www.youtube.com/watch?v=v5IHJk16H5E
Love Rap Spoonie Gee,https://www.youtube.com/watch?v=YfWfiP_x6WE
Backdoor Lil Durk,https://www.youtube.com/watch?v=Ty-CHgmCeKw
WW2 Unknown T,https://www.youtube.com/watch?v=qi5K4D3bHVM
Player's Ball Outkast,https://www.youtube.com/watch?v=vFofKGKlWo4
Mystery Lady (feat. Don Toliver) Masego,https://www.youtube.com/watch?v=5i6A1IHAQsg
Scripture Dexta Daps,https://www.youtube.com/watch?v=Hwv_QXBZdiE
Only the Rated Westy,https://www.youtube.com/watch?v=aV0Z81KyiZY
Deluded (feat. MIST) Tion Wayne,https://www.youtube.com/watch?v=S3G-NfxWHJY
Opp Stoppa (feat. Lil Eazzyy) YBN Nahmir,https://www.youtube.com/watch?v=mZktDQlxRoE
Beautiful Snoop Dogg,https://www.youtube.com/watch?v=_FE194VN6c4
That's Life (feat. OMB Peezy) LBS Kee'vin,https://www.youtube.com/watch?v=8Vdo10Fr5vc
מדינת משטרה Ravid Plotnik,https://www.youtube.com/watch?v=NvBvp9YHZd4
"Hold It Now, Hit It Beastie Boys",https://www.youtube.com/watch?v=oB0NM6reiRE
"The Click (feat. Zaybang, Lil Bean, KxNG LLAMA, Lil Yee, Prezi & Lil Pete) Zaytoven",https://www.youtube.com/watch?v=cHJ_ECN0xiE
Something's Gotta Give Sonna,https://www.youtube.com/watch?v=7ZFOZNFZKy0
So Pretty Reyanna Maria,https://www.youtube.com/watch?v=4j_AY3pd-GE
nhs slowthai,https://www.youtube.com/watch?v=QBbxFeSTJ2Y
Waterboy Dexplicit,https://www.youtube.com/watch?v=X7upPqO4Fds
Birthday (feat. Kalan.FrFr & Chris O'Bannon) Compton Av,https://www.youtube.com/watch?v=5lXLSQUDomc
FTP YG,https://www.youtube.com/watch?v=_NFJtEqO0HU
Adderall (Corvette Corvette) - Remix Popp Hunna,https://www.youtube.com/watch?v=D5FdrOx2aZk
Love Is Blind OMB Peezy,https://www.youtube.com/watch?v=xQZcXVUmwVc
My People Amber Mark,https://www.youtube.com/watch?v=JbsJE21-Q_I
Dancing in My Room 347aidan,https://www.youtube.com/watch?v=HG_ZC9N_4NM
Fake Love LiL Lotus,https://www.youtube.com/watch?v=otVufKyEvBc
Black Girl Memoir Iamdoechii,https://www.youtube.com/watch?v=p2JfJE5SbzM
Outside Yvette,https://www.youtube.com/watch?v=NtXURS9Ktd0
Drinks On Me Eyez,https://www.youtube.com/watch?v=CgZCOUmnn0g
Kosher Gufani Cohen@Mushon,https://www.youtube.com/watch?v=Bp7y1O7wcGk
Ice Water (feat. Trippie Redd) Lil Skies,https://www.youtube.com/watch?v=az_tB_aOWE4
RAT RACE Al-Doms,https://www.youtube.com/watch?v=o2AiI4adHpA
After Kikar Party Parvarim Refugeez,https://www.youtube.com/watch?v=v5n-cmT_WCA
Dead Bro GirlzLuhDev,https://www.youtube.com/watch?v=FSiLYRMU9aU
Bloodrush Andrew Broder,https://www.youtube.com/watch?v=uy3-thS3wjo
How Ya Livin' featuring Nas AZ,https://www.youtube.com/watch?v=UFFpFeTZXFA
No More Parties Coi Leray,https://www.youtube.com/watch?v=my2ZvqmPaco
Beats to the Rhyme Run–D.M.C.,https://www.youtube.com/watch?v=8oNOAXJDJio
Thugged Out (feat. Kodak Black) YNW Melly,https://www.youtube.com/watch?v=69RrVdbjrHM
White Teeth YoungBoy Never Broke Again,https://www.youtube.com/watch?v=V2GhUGSOhEc
Moving Fast (feat. Jared Anthony) Mike Crigs,https://www.youtube.com/watch?v=CSTklwWsuAA
מוזיקה טובה (נצ'י נצ') Ravid Plotnik,https://www.youtube.com/watch?v=jKW9mXiumNw
This Weekend (feat. Ty Dolla $ign) Phora,https://www.youtube.com/watch?v=79HDs-veHS0
Grinding Away D Double E,https://www.youtube.com/watch?v=jFnzNK9ZipY
Family Matters (feat. Flo Milli) TOBi,https://www.youtube.com/watch?v=IrDrMA1gjr4
Queen Bitch Lil' Kim,https://www.youtube.com/watch?v=8rJ7VZadCGc
CAN I? Deema,https://www.youtube.com/watch?v=Xt7Tr8EFsYs
Real Black (feat. Voices for Change) Kevin Ross,https://www.youtube.com/watch?v=K2si19K39-U
Shinin FCG Heem,https://www.youtube.com/watch?v=_-Vaok5ppRw
The Way I Am Eminem,https://www.youtube.com/watch?v=KWmG0ZsUAag
אין בינינו חלל Tuna,https://www.youtube.com/watch?v=3tD-AMdlNDE
Where I'm From Digable Planets,https://www.youtube.com/watch?v=sl-pjb7y3y0
Eastender Morrisson,https://www.youtube.com/watch?v=Oqf3ZlG0T_c
Batman LPB Poody,https://www.youtube.com/watch?v=a5sdCwzqIkE
Shangralah Just Geo,https://www.youtube.com/watch?v=uvJZpl1EfOA
Mood Swings (feat. Lil Tjay) Pop Smoke,https://www.youtube.com/watch?v=mM8ostx0Ub8
We Straight (feat. Vince Staples) ALLBLACK,https://www.youtube.com/watch?v=vV_EP4MDLW0
Thieves In Atlanta (feat. Coi Leray) Yung Bleu,https://www.youtube.com/watch?v=AvFfleLxzmc
Suttin Like That - Instrumental KURUPT FM,https://www.youtube.com/watch?v=y23X-gJfRbw
Lion Karolina,https://www.youtube.com/watch?v=fj-S3eUfztw
Non Stop ShrekDiMC,https://www.youtube.com/watch?v=heCPxjT-8wg
Forever Tom The Mail Man,https://www.youtube.com/watch?v=F86ciCyfVWc
Stormy Weather Wiley,https://www.youtube.com/watch?v=j8zbaIo3ZEw
Knuck If You Buck (feat. Lil' Scrappy) Crime Mob,https://www.youtube.com/watch?v=TC1oURSaYoQ
P's and Q's Kano,https://www.youtube.com/watch?v=Mznv4ACjkzc
Live & Direct - Live Jazzbois,https://www.youtube.com/watch?v=WngSLgIVegc
"Not Tonight (feat. Da Brat, Left Eye, Missy ""Misdemeanor"" Elliott and Angie Martinez) - Remix Lil' Kim",https://www.youtube.com/watch?v=9FzY0xvQDps
Top (Remix) feat. Lil Durk Fredo Bang,https://www.youtube.com/watch?v=o0QB6cXs1_k
Way We Move Big Ghost Ltd,https://www.youtube.com/watch?v=LtJvEVpYnoo
Danger (Been So Long) featuring Nivea Mystikal,https://www.youtube.com/watch?v=ZHrV51GOPkE
Move Bitch Disturbing Tha Peace,https://www.youtube.com/watch?v=tw429JGL5zo
Real Shit (with benny blanco) Juice WRLD,https://www.youtube.com/watch?v=2jqMRwOC0wY
Enough Lil Mosey,https://www.youtube.com/watch?v=XX60I-Cmook
3AM payton,https://www.youtube.com/watch?v=TblV4s470MM
MOVE DOLEY DUSTY LOCANE,https://www.youtube.com/watch?v=6_E1VJS2z_w
Let Me Ride Dr. Dre,https://www.youtube.com/watch?v=YtrkoddJSRc
Smile Monjola,https://www.youtube.com/watch?v=2j9b09Q3IEw
"Freeze Me (feat. Gucci Mane, T.I.) Mr. E Blend Young Dro",https://www.youtube.com/watch?v=Ijn4IXS4X80
תן לי מנגינה Hadag Nahash,https://www.youtube.com/watch?v=kWoHmDYpuzg
All in All Yungeen Ace,https://www.youtube.com/watch?v=8qTKeGI3iis
Definition Black Star,https://www.youtube.com/watch?v=EuJaStSL0xM
DM LUX€ BOYZ,https://www.youtube.com/watch?v=YFhaCYWCMh8
Three Cuts (feat. Maino) Jim Jones,https://www.youtube.com/watch?v=awJPEE-kMsE
Dream in Color Cordae,https://www.youtube.com/watch?v=ByaqLK4-mUY
Wifey Tinie Tempah,https://www.youtube.com/watch?v=4CV4PJS9FPQ
These Streets (Don't Luv U) (feat. Popcaan) The FaNaTiX,https://www.youtube.com/watch?v=LrJxQbd2At8
Disaster Kxllswxtch,https://www.youtube.com/watch?v=Y0XWASx3NIE
אל תשגע אותי ShrekDiMC,https://www.youtube.com/watch?v=cY_ss-_4rl8
Money On My Head Wavy Navy Pooh,https://www.youtube.com/watch?v=mlEo-QbrqsI
Pray jxdn,https://www.youtube.com/watch?v=6jKjB0XT-oE
Organic Rust Alfa Mist,https://www.youtube.com/watch?v=kkkfjpwCv6E
Gilmore Kai Ca$h,https://www.youtube.com/watch?v=LJG5e8J3uNA
ביצ’הביתה Shipi,https://www.youtube.com/watch?v=l_FDJyLFGPY
New Shape Young T & Bugsey,https://www.youtube.com/watch?v=6YD9y2daFpk
Low Key (feat. Lil Uzi Vert) Doe Boy,https://www.youtube.com/watch?v=4CtzLbEDF6E
N 2 Gether Now Limp Bizkit,https://www.youtube.com/watch?v=Glc-9qvWcP8
Mic Checka Das EFX,https://www.youtube.com/watch?v=BXSBk_ebq-A
Go Big YG,https://www.youtube.com/watch?v=tVbPjSisoDY
Last Time (feat. Travis Scott) Gucci Mane,https://www.youtube.com/watch?v=42Amfo4YN8c
Different - Freestyle DreamDoll,https://www.youtube.com/watch?v=bcG496wqVQs
One Take Ghetts,https://www.youtube.com/watch?v=PhI0Ug8CotY
Weight Angel Haze,https://www.youtube.com/watch?v=oOycRO6mabo
Nasty (feat. Rubi Rose) Rich The Kid,https://www.youtube.com/watch?v=fTA3tBi9npU
Hustlin' Rick Ross,https://www.youtube.com/watch?v=JU9TouRnO84
23 IVOXYGEN,https://www.youtube.com/watch?v=lO4tgI2wEHw
I Get the Bag (feat. Migos) Gucci Mane,https://www.youtube.com/watch?v=uo14xGYwWd4
Say the Name clipping.,https://www.youtube.com/watch?v=hRP5uAuDAr4
roddy Kevin Powers,https://www.youtube.com/watch?v=ZcjgaVPNSag
Final Hour Ms. Lauryn Hill,https://www.youtube.com/watch?v=3VnAdQghhOY
Ya Playin' Yaself Jeru The Damaja,https://www.youtube.com/watch?v=i0zHaI4Soqk
Page 45 TeeZandos,https://www.youtube.com/watch?v=Nctc_YRuWSY
Faygo Baby Kipp Stone,https://www.youtube.com/watch?v=mHCDGh5aM7o
Knock Your Block Off Jme,https://www.youtube.com/watch?v=HrPA5U4CHBo
Can I Kick It? A Tribe Called Quest,https://www.youtube.com/watch?v=7D_JwgIM-y4
Reality (feat. YEHAIYAHAN) J-Hoon,https://www.youtube.com/watch?v=NUVcQX5PNsE
Whuteva Remy Ma,https://www.youtube.com/watch?v=nLJVyeEQNm4
Impatient (feat. Coi Leray) DDG,https://www.youtube.com/watch?v=0BZgwzyocbA
Snakes & Fakes Fizzler,https://www.youtube.com/watch?v=wtWPnj7JAIs
Anxious AJ Tracey,https://www.youtube.com/watch?v=h_tJFQ74Vuw
WIN Jay Rock,https://www.youtube.com/watch?v=JrO46CJd9ns
Let's Get Dirty (I Can't Get In Da Club) Redman,https://www.youtube.com/watch?v=_b_zT6mdN3c
Here We Go (feat. Kelly Rowland) Trina,https://www.youtube.com/watch?v=dke-dT3vLNM
SMALL TALK Russ,https://www.youtube.com/watch?v=NyW_MLuM3e0
the outside Vorsa,https://www.youtube.com/watch?v=DurR0SztkJ8
Free - Afro Beat Subliminal,https://www.youtube.com/watch?v=P_a9ZnR5QKw
Lotto - Part 2 TiaCorine,https://www.youtube.com/watch?v=8QY3UO1N6W4
Kash App (feat. Mulatto) BRS Kash,https://www.youtube.com/watch?v=vBTvfzIYpx8
Push It Salt-N-Pepa,https://www.youtube.com/watch?v=vCadcBR95oU
Vision Genesis Elijah,https://www.youtube.com/watch?v=WBV0XF1pAIs
Nunnadet Shit Asian Doll,https://www.youtube.com/watch?v=aDpg15B5MEY
ריח טוב עם מבוא הדודאים Big Sezo,https://www.youtube.com/watch?v=ztvBb_eBbro
יהיה מה שיהיה DJ Mesh,https://www.youtube.com/watch?v=5184SdVwnRo
קח את זה Benny Esterkin,https://www.youtube.com/watch?v=lqOJS248xB8
Welcome To Brixton SR,https://www.youtube.com/watch?v=svxwIa5mxjQ
Demons Stunna Gambino,https://www.youtube.com/watch?v=TJhqsLxAdS4
It's Like That Run–D.M.C.,https://www.youtube.com/watch?v=TLGWQfK-6DY
NOHO (feat. ICECOLDBISHOP) AG Club,https://www.youtube.com/watch?v=Y8QvsSG4658
Toot That (feat. Beatking) Erica Banks,https://www.youtube.com/watch?v=M0lSyyNRIPo
The Man Curtis J,https://www.youtube.com/watch?v=mST0NP5QwUo
Big City Lucille Crew,https://www.youtube.com/watch?v=WLYaPB88L1Q
listen to my album Marlon Craft,https://www.youtube.com/watch?v=uLDa1oenDkw
Sunshine (The Light) Fat Joe,https://www.youtube.com/watch?v=kuO9OC2H9Qs
So What'Cha Want Beastie Boys,https://www.youtube.com/watch?v=ru3gH27Fn6E
Emotions Ollie,https://www.youtube.com/watch?v=8wkY9IWvFt0
USAY JAHMED,https://www.youtube.com/watch?v=LspAYACFI1o
Clap For 'Em (feat. Flo Milli & Sada Baby) YungManny,https://www.youtube.com/watch?v=Al6QspEepXE
ממה אתה בורח Narkis,https://www.youtube.com/watch?v=cygPoBA46FY
MAYA PRICE,https://www.youtube.com/watch?v=d1xUXNdH1CM
Ka$H Only Khia,https://www.youtube.com/watch?v=bzptjAhY9xA
Clicquot Shower Caleborate,https://www.youtube.com/watch?v=lTJjFRPa8sY
Time's Up O.C.,https://www.youtube.com/watch?v=6gNmCGQRpcc
מייצג Peled,https://www.youtube.com/watch?v=Ffe7UB5iysw
Call Me Nobody (feat. Lil Wayne & Isaiah Lyric) Clever,https://www.youtube.com/watch?v=rkPjLQu_IEs
Straight To It Young Devyn,https://www.youtube.com/watch?v=59jH6Eom6x8
Options (with Wale) EARTHGANG,https://www.youtube.com/watch?v=ZEyG7fpJcR0
Link Up (feat. Pooh Shiesty) Lil Loaded,https://www.youtube.com/watch?v=5eoK0G8HHvc
Grown Man Sport Pete Rock,https://www.youtube.com/watch?v=d9LhFN3H20M
מי שצועק Cohen@Mushon,https://www.youtube.com/watch?v=vJR8czIZlHU
Bougie Lozy,https://www.youtube.com/watch?v=z_P7j8sEOs8
War Lord Swifta Beater,https://www.youtube.com/watch?v=Akg7lwfUrLI
Currency Zdot,https://www.youtube.com/watch?v=JwzqzjsxbAo
Bust A Move Young MC,https://www.youtube.com/watch?v=xy4FXhkm6Nw
Your Love Nicki Minaj,https://www.youtube.com/watch?v=pSFyrrhKj1Q
H2O DJ Chose,https://www.youtube.com/watch?v=-6UctStQJ4o
Happy Belated Crafty 893,https://www.youtube.com/watch?v=OwpDfnNy9mI
Winner Stays On. Just Geo,https://www.youtube.com/watch?v=H8C3Djwqx2g
Dagger Jacker Just Geo,https://www.youtube.com/watch?v=6ViLNA34lkc
ענבל אור Sagol 59,https://www.youtube.com/watch?v=5q-2YPoWz80
Paid In Full - Seven Minutes Of Madness - The Coldcut Remix Eric B. & Rakim,https://www.youtube.com/watch?v=IX9FXinBkbg
הנוף משתנה NUMI,https://www.youtube.com/watch?v=6XcGXdsdogM
Wildstyle Time Zone,https://www.youtube.com/watch?v=5NBND5cQx4U
Tonight (feat. D-Block Europe & OBOY) Ghost Killer Track,https://www.youtube.com/watch?v=Lbt3wOhMRpg
Superstar (feat. Matthew Santos) Lupe Fiasco,https://www.youtube.com/watch?v=hVkBlsgthLg
Igloo Wiley,https://www.youtube.com/watch?v=SEh8-a2mDF4
הכל יסתדר Hadag Nahash,https://www.youtube.com/watch?v=xFC5d1z7jOQ
iBunk Just Geo,https://www.youtube.com/watch?v=wuSLkIlcfCA
You Can't Play with My Yo-Yo (feat. Ice Cube) Yo-Yo,https://www.youtube.com/watch?v=Hw16s2ciZ1w
"Young, Gifted and Black Aretha Franklin",https://www.youtube.com/watch?v=qFidgjq9rIo
Traumatized (feat. Toosii) Phora,https://www.youtube.com/watch?v=yuDpgbHN_aE
Opp Stoppa (feat. 21 Savage) YBN Nahmir,https://www.youtube.com/watch?v=UXXGfp-z850
Toot It Up YG,https://www.youtube.com/watch?v=UOcwZwBaSfs
מותק אנ׳לא משלם Lukach,https://www.youtube.com/watch?v=Cvg7OdXjznI
"Mob Ties Remix (feat. Unfoonk, 24Heavy, Future & YTB Trench) Young Stoner Life",https://www.youtube.com/watch?v=nlXJZuPJdec
Horse & Carriage (feat. Mase) Cam’ron,https://www.youtube.com/watch?v=Rv-0leUtYzk
Everybody Loves You Felly,https://www.youtube.com/watch?v=MXVrpT5Npgs
Take You Home (feat. Kelis) Angie Martinez,https://www.youtube.com/watch?v=u4dDPxh_q7w
Made Me Everything Pt. 2 (feat. Maxo Kream) TOBi,https://www.youtube.com/watch?v=lJleR3wKXg0
Get Me Home Foxy Brown,https://www.youtube.com/watch?v=5Cm8kaJZKAY
מרפקים Tuna,https://www.youtube.com/watch?v=wZkxte5sXH4
World On Silent Anoyd,https://www.youtube.com/watch?v=81jLlkwlrAM
Allowance (feat. Kash Doll) Babyface Ray,https://www.youtube.com/watch?v=XdpQUDbAEYg
Mad Nice Jalen Santoy,https://www.youtube.com/watch?v=Li_Ng2wX-kw
School Spirit Kanye West,https://www.youtube.com/watch?v=XZRAJ-DT-Us
SUV Olmos,https://www.youtube.com/watch?v=wT58OVJVnbQ
